Bill Id,Long Title,Short Title,Origin_House,Status,SessionID
1083,A Bill to amend section 62 of the Coroners and Justice Act 2009 to apply additionally to the possession of prohibited written material about children; to make consequential amendments to the Act; and for connected purposes,Coroners and Justice (Amendment) Bill,Commons,1,25
1131,A Bill to hold corporations criminally accountable for abuse and neglect in care settings; to make provision to compel any person or organisation to supply information to Adult Safeguarding Boards; and to introduce a new offence of corporate neglect whereby a corporate body can be found guilty if the way in which its activities are managed or organised by its board or senior management is a substantial element in the existence or possible occurrence of abuse or neglect.,Corporate Accountability and Safeguarding of Adults from Abuse and Neglect Bill,Commons,1,25
1075,"A Bill to establish minimum standards for the practice of cosmetic surgery, including non-surgical procedures; and for connected purposes",Cosmetic Surgery (Minimum Standards) Bill,Commons,1,25
1108,A Bill to require credit card companies to discharge a debt when three times the equivalent of the principal sum owed has been paid in interest; and for connected purposes,Credit Card Debt Limit Bill,Commons,1,25
1051,A Bill to require energy companies to provide the cheapest available tariff to customers aged 75 or over; and for connected purposes.,Energy Companies (Minimum Tariffs) Bill,Commons,1,25
1134,A Bill to amend the Energy Act 2011 to enable residents of houses in multiple occupation to benefit from the provisions in the Act designed to increase energy efficiency; and for connected purposes.,Energy Efficiency (Houses in Multiple Occupation) Bill,Commons,1,25
1117,A Bill to promote energy efficiency and a reduction in energy costs; and for connected purposes.,Energy Efficiency and Reduction in Energy Costs Bill,Commons,1,25
1137,A Bill to amend the protected characteristics in the Equality Act 2010 to include a person’s conscientious beliefs about the definition of marriage; and for connected purposes.,Equality (Marriage) (Amendment) Bill,Commons,1,25
1106,A Bill to amend the Equality Act 2010 to remove discrimination against women in relation to consecration of bishops in the Church of England; and for connected purposes.,Equality Act 2010 (Amendment) Bill,Commons,1,25
1035,A Bill to repeal the European Communities Act 1972 and related legislation; and for connected purposes.,European Communities Act 1972 (Repeal) Bill,Commons,1,25
1069,A Bill to apply the terms of the European Union Act 2011 such as to require approval by Act of Parliament and by referendum of provisions for creating a fiscal union or economic governance within the Eurozone.,European Union Act 2011 (Amendment) Bill,Commons,1,25
1097,A Bill to disapply the European Union Free Movement Directive 2004/38/EC; and for connected purposes,European Union Free Movement Directive 2004 (Disapplication) Bill,Commons,1,25
1058,A Bill to require that companies’ remuneration committees have employee representation; to require that companies hold an annual binding shareholder vote on executive remuneration; and for connected purposes,Executive Pay and Remuneration Bill,Commons,1,25
1029,"A Bill to make provision regarding arrangements for children involved in court cases; to make provision about the transparency, administration and accountability of courts and case conferences; to require the promotion of measures to assist families and such other persons as may be specified to reduce the cost of living through lower fuel bills; and for connected purposes.","Family Justice (Transparency, Accountability and Cost of Living) Bill",Commons,1,25
1101,A Bill to require the Secretary of State to provide appropriate perinatal support to any family expecting a child who will be born on to the child protection register and for whom an adoption plan has not been made at the moment the child is entered on to the register; to require that a decision be made not later than one year after the child’s birth as to whether or not such a child will be adopted; and for connected purposes,Family Perinatal Support and Adoption Bill,Commons,1,25
1052,A Bill to make provision for the inclusion of financial literacy in the national curriculum; and for connected purposes,Financial Literacy (Curriculum) Bill,Commons,1,25
1065,"A Bill to require a football club playing in the top four tiers of English and Scottish professional football to disclose the identity of its owner, the identity of the owner of its home playing ground, training ground, any intellectual property associated with the club or a third party stake in its players and the identities of outstanding creditors; to require all creditors of a football club to be compensated equally should the club go into administration; and for connected purposes",Football (Financial Transparency) Bill,Commons,1,25
1100,"A Bill to make provision to introduce free school meal arrangements for children over the age of 16 who attend colleges to bring them into line with arrangements for children who attend schools, academies and free schools; and for connected purposes",Free School Meals (Children over the age of 16) Bill,Commons,1,25
1034,A Bill to introduce a principle that any financial arrangements made by a company or individual should not have as their primary purpose the avoidance of tax; to establish a statutory rule to apply in the assessment of such arrangements; and for connected purposes.,General Anti Tax-Avoidance Principle Bill,Commons,1,25
1144,A Bill to amend the Insolvency Act 1986 to make purchasers of gift vouchers preferential creditors during the administration of a company; and for connected purposes.,Gift Vouchers and Insolvency Bill,Commons,1,25
1060,A Bill to require that mortgage interest rates paid by homeowners change by at least the same percentage as mortgage interest base rates; and for connected purposes,Homeowners’ Mortgage Interest Rates Bill,Commons,1,25
1070,A Bill to make provision for husbands and civil partners of those receiving honours to be allowed to use equivalent honorary titles to those available to women; and for connected purposes.,Honours (Equality of Titles for Partners) Bill,Commons,1,25
1067,"To make provision about the membership of the House of Lords; to make
provision about the disclaimer of life peerages; to abolish the jurisdiction of
the House of Lords in relation to peerage claims; to make other provision
relating to peerage; and for connected purposes.",House of Lords Reform Bill,Commons,1,25
1138,"A Bill to amend section 157 of the Housing Act 1985 to extend the use of local occupancy clauses to certain urban areas with the permission of the Secretary of State; to increase the qualifying period of local occupancy clauses from three years to either five or ten years; to place a duty on the Homes and Communities Agency and local authorities with housing and planning responsibilities to promote co-operative and mutual housing options and report annually in this regard; to require the Homes and Communities Agency, local authorities and the Land Registry to identify land available for housing development which has not been developed and to publish a report on the available options for development of housing on such land; and for connected purposes.",Housing Market Reform Bill,Commons,1,25
1048,A Bill to repeal the Human Rights Act 1998 and related legislation; to make provision for a bill of rights and responsibilities to apply to the United Kingdom; and for connected purposes,Human Rights Act 1998 (Repeal and Substitution) Bill,Commons,1,25
1161,"A Bill to amend the Immigration and Asylum Act 1999 to require the Secretary of State to review levels of asylum support annually; to require him to lay before Parliament a draft up-rating order to increase levels of asylum support in line with changes made to mainstream benefits in years when the general level of prices has increased during the previous 12 month period; to replace support provided by the voucher system under subsections (10) and (11) of section 4 of the Act with a single, cash-based support system; and for connected purposes.",Immigration and Asylum Act 1999 (Amendment) Bill,Commons,1,25
1041,A Bill to make provision about the meeting by the United Kingdom of the target for official development assistance (ODA) to constitute 0.7 per cent of gross national income; to make provision for independent verification that ODA is spent efficiently and effectively; and for connected purposes.,International Development (Official Development Assistance Target) Bill,Commons,1,25
1114,A Bill to prohibit the advertising of long-term unpaid internships; to regulate conditions of employment for paid internships; and for connected purposes,Internships (Advertising and Regulation) Bill,Commons,1,25
1062,"A Bill to require the Secretary of State to commission a programme of research into the merits of replacing the Council Tax and Non-domestic rates in England with an annual levy on the unimproved value of all land, including transitional arrangements; to report to Parliament within 12 months of completion of the research; and for connected purposes",Land Value Tax Bill,Commons,1,25
1064,A Bill to require local authorities to operate landlord accreditation schemes; to set those schemes according to minimum standards; and for connected purposes,Landlord Accreditation Bill,Commons,1,25
1147,A Bill to require the Government to publish a list of the powers of local councils and a code of conduct defining the degree of autonomy attached to those powers and areas where a council may act autonomously; to create a mechanism to identify and adjudicate on breaches of the code by either central or local government; and for connected purposes.,Local Authority Devolution and Powers Bill,Commons,1,25
1073,"A Bill to enable local planning authorities to require the granting of planning permission prior to the demolition or change of use of premises or land used or formerly used as a public house or local independent shop, to enable local planning authorities to require the granting of planning permission if premises or land will be used for a supermarket; and for connected purposes.",Local Services (Planning) Bill,Commons,1,25
1119,A Bill to make provision for filling vacancies among Lords Spiritual sitting and voting as Lords of Parliament.,Lords Spiritual Bill,Commons,1,25
1063,A Bill to require the Secretary of State to make provision to limit energy contract roll-over for micro businesses to 30 days; and for connected purposes,Micro Businesses and Energy Contract Roll-Over Bill,Commons,1,25
1118,A Bill to require multinational motor manufacturing companies to provide a duty of care to former employees in respect of pension provision,Multinational Motor Manufacturing Companies (Duty of Care to Former Employees) Bill,Commons,1,25
1151,A Bill to introduce a national day to raise awareness of the contribution of Commonwealth countries in military action of Great Britain and the Overseas Territories; and for connected purposes.,National Commonwealth Military Day Bill,Commons,1,25
1082,A Bill to require the Secretary of State to instruct the National Health Service to record and audit the cost of treatment of individuals not entitled to free health care and of foreign nationals under the European Health Insurance Card Scheme and other reciprocal healthcare agreements; and for connected purposes.,NHS Audit Requirements (Foreign Nationals) Bill,Commons,1,25
1039,A Bill to make provision for the establishment of a compulsory registration scheme for off-road mechanically propelled vehicles; and for connected purposes.,Off-Road Vehicles (Registration) Bill,Commons,1,25
1061,"A Bill to amend the Gambling Act 2005 to regulate remote gambling on a point of consumption basis; to require all operators selling into the British market, whether in the United Kingdom or overseas, to hold a Gambling Commission licence to enable them to undertake transactions with British consumers and to advertise in the United Kingdom; to provide that all relevant operators contribute to the Horserace Betting Levy; and for connected purposes",Offshore Gambling Bill,Commons,1,25
1154,A Bill to give effect to Schedule 5 of the Localism Act 2011; to amend section 52ZC of the Government Finance Act 1992 (inserted by that Schedule) to require parish and town councils to conduct local referendums in the event that they choose to increase their precept by 2 per cent or more in the following financial year; and for connected purposes.,Parish and Town Council Precepts (Referendums) Bill,Commons,1,25
1120,A Bill to amend the Planning Act 2008 to exempt planning applications for onshore wind farms producing 50 megawatts or more; to provide that they be referred for decision to local planning authorities; and for connected purposes,Planning Act 2008 (Amendment) Bill,Commons,1,25
1116,A Bill to provide that communities may appeal against planning decisions on collection of the signatures of a required percentage of the electorate in the relevant ward within a designated time period; and for connected purposes.,Planning Applications (Community Right of Appeal) Bill,Commons,1,25
1162,A Bill to enable local planning authorities to impose a mandatory financial penalty where planning permission has been deliberately breached; and for connected purposes.,Planning Permission (Financial Penalties) Bill,Commons,1,25
1079,A Bill to require local authorities to impose mandatory use of plastic glasses and bottles in licensed premises; and for connected purposes,Plastic Glasses and Bottles (Mandatory Use) Bill,Commons,1,25
1047,A Bill to make provision for the Ports Act 1991 to cease to have effect or application in certain circumstances; and for connected purposes,Ports Act 1991 (Amendment) Bill,Commons,1,25
1080,A Bill to require the Secretary of State to raise the level of debt below which pre-paid meter customers may change their energy supplier; and for connected purposes;,Pre-Paid Meters (Level of Debt) Bill,Commons,1,25
1040,"A Bill to amend the Price Marking Order 2004 to simplify, consolidate and improve price marking legislation; and for connected purposes.",Price Marking (Consumer Information) Bill,Commons,1,25
1148,A Bill to require the Secretary of State to amend legislation to allow for noise contours to be used as a measure of property blight caused by national infrastructure projects; and for connected purposes.,Property Blight Compensation Bill,Commons,1,25
1049,A Bill to make provision for the resolution of disputes concerning the location or placement of the boundaries relating to the title of an estate in land; and for connected purposes,Property Boundaries (Resolution of Disputes) Bill,Commons,1,25
1096,A Bill to create a specific offence relating to assault on those whose work brings them into face-to-face contact with members of the public; and for connected purposes.,Protection of Workers Bill,Commons,1,25
1046,A Bill to limit government budget deficits; to introduce a ceiling on public debt; and for connected purposes,Public Debt Management Bill,Commons,1,25
1068,A Bill to permit voters to recall their elected representatives in specified circumstances; and for connected purposes.,Recall of Elected Representatives Bill,Commons,1,25
1127,A Bill to require the Secretary of State to introduce a regulatory regime for bailiffs which would preclude the making of multiple fee charges without explanation; to introduce guidelines for dealing with potentially vulnerable debtors; and for connected purposes,Regulation of Bailiffs Bill,Commons,1,25
1085,A Bill to make provision relating to signage and ticketing technology for parking charges used in publicly-available car parks; and for connected purposes,Regulation of Signage and Ticketing Technology (Publicly-Available Car Parks) Bill,Commons,1,25
1146,A Bill to provide for the regulation of letting agents; to protect tenants’ deposits; to require the enforcement of environmental and energy-efficiency standards in private-sector rented accommodation; to amend the law on secure tenancies; to provide for fair rent to be applicable to all rented accommodation; to require landlords not to discriminate against people in receipt of state benefits; to require local authorities to establish a private rented sector office; and for connected purposes.,Regulation of the Private Rented Sector Bill,Commons,1,25
1088,"A Bill to require the Secretary of State to make provision to include relationship, drug and alcohol education in the national curriculum; and for connected purposes","Relationship, Drug and Alcohol Education (Curriculum) Bill",Commons,1,25
1103,Enable representation of a constituency by two persons sharing membership of the House of Commons; and for connected purposes,Representation of the People (Members' Job Share) Bill,Commons,1,25
1145,"A Bill to enable pupils in primary, middle, high and secondary schools to gain greater understanding of careers in science, technology and engineering; to establish a duty on schools to provide opportunities for pupils to gain such understanding; to provide for the establishment of advisory groups drawn from industry and relevant external bodies to assist schools in the provision of such opportunities; to require governing bodies of middle, secondary and high schools to include two local employers; to impose a duty on the Department for Education to ensure a database of national schemes providing relevant opportunities is established; to enable graduate level practitioners of science, technology, engineering and mathematics to teach these subjects in schools for limited periods without full teaching qualifications; and for connected purposes.","Science, Technology and Engineering (Careers Information in Schools) Bill",Commons,1,25
1036,"A Bill to make provision about the duties of local authorities in relation to the sufficiency of provision of social care and related support; to make provision about the duties of health bodies in England in relation to the identification and support of carers; to make provision in relation to the responsibilities of local authorities, schools and higher and further education organisations for the needs of young carers and their families; and for connected purposes.",Social Care (Local Sufficiency) and Identification of Carers Bill,Commons,1,25
1155,A Bill to remove male-preference primogeniture in succession to hereditary peerages and estates.,Succession to Hereditary Peerages and Estates Bill,Commons,1,25
1102,"A Bill to require the Secretary of State to set up a body to establish a public initiative for the prevention of suicide and self harm, to work with internet providers and others to reduce access to information on the internet and through other sources on methods of suicide and to develop a system of alerts and blocks for internet searches relating to suicide; and for connected purposes",Suicide (Prevention) Bill,Commons,1,25
1129,"A Bill to require supermarkets to publish pricing data on all the goods they sell in a standardised, accessible, online format suitable to enable comprehensive comparison of the price of supermarket goods by retailer, store and product, and to enable independent analysis of pricing; and for connected purposes.",Supermarket Pricing Information Bill,Commons,1,25
1072,A Bill to amend the Town and Country Planning (Control of Advertisements) (England) Regulations 2007 to limit the display of external advertisements concerning lettings; and for connected purposes.,Town and Country Planning (Control of Advertisements) (England) Regulations 2007 (Amendment) Bill,Commons,1,25
1059,A Bill to require train companies to offer customers the cheapest available fare as a first option; and for connected purposes,Train Companies (Minimum Fares) Bill,Commons,1,25
1043,"A Bill to require large companies in the UK to make annual statements of measures taken by them to eradicate slavery, human trafficking, forced labour and the worst forms of child labour (as set out in Article 3 of the International Labour Organisation’s Convention No. 182) from their supply chains; to require such companies to provide customers and investors with information about measures taken by them to eliminate slavery, human trafficking, forced labour and the worst forms of child labour; to provide victims of slavery with necessary protections and rights; and for connected purposes.",Transparency in UK Company Supply Chains (Eradication of Slavery) Bill,Commons,1,25
1156,A Bill to require individuals standing for elected office in the United Kingdom of Great Britain and Northern Ireland to declare any political party of which they are a member when registering to stand; and for connected purposes.,UK Elected Representatives (Disclosure of Party Membership) Bill,Commons,1,25
1132,A Bill to extend the powers of prosecuting authorities to appeal against unduly lenient sentences imposed in the criminal courts.,Unduly Lenient Sentences (Right of Appeal) Bill,Commons,1,25
1074,"A Bill to allow subjects of Her Majesty’s realms to enter the United Kingdom through a dedicated channel at international terminals, to ensure that all points of entry to the United Kingdom at airports, ports and terminals display prominently a portrait of Her Majesty as Head of State, the Union Flag and other national symbols; to rename and re-establish the UK Border Agency as ‘Her Majesty’s Border Police’; and to enhance the Agency’s powers to protect and defend the borders of the United Kingdom of Great Britain and Northern Ireland.",United Kingdom Borders Bill,Commons,1,25
1143,A Bill to make provision for a referendum in the next Parliament on the question of whether the United Kingdom should remain a member of the European Union; and for connected purposes.,United Kingdom Membership of the European Union (Referendum) Bill,Commons,1,25
1094,A Bill to give effect to Schedule 6 to the Courts Act 2003; to provide thereby for the imposition of unpaid work orders to pay financial penalties; and for connected purposes,Unpaid Work Orders (Pilot Scheme) Bill,Commons,1,25
1087,A Bill to make provision for receipts for vehicle fuel to display the amount of fuel duty paid and the amount of that duty to be spent on road building; and for connected purposes,Vehicle Fuel Receipts (Transparency of Taxation) Bill,Commons,1,25
1133,"A Bill to allow persons aged 16 years or older to vote as electors at parliamentary and local government elections, and in referendums; and for connected purposes.",Voting Age (Reduction to 16) Bill,Commons,1,25
1055,A Bill to require water companies to provide the cheapest available tariff to customers aged 75 or over; and for connected purposes,Water Companies (Minimum Tariffs) Bill,Commons,1,25
1054,A Bill to require water companies to provide social tariffs for low income families; and for connected purposes,Water Companies (Social Tariffs) Bill,Commons,1,25
1124,A Bill to provide for the introduction of a welfare cash card; and for connected purposes.,Welfare Cash Card Bill,Commons,1,25
1053,A Bill to prohibit the use of wild animals in circuses; and for connected purposes,Wild Animals in Circuses Bill,Commons,1,25
1032,"A Bill to provide for the early payment of winter fuel allowance to eligible persons whose residences are not connected to the mains gas grid and whose principal source of fuel is home fuel oil, liquid petroleum gas or propane gas; and for connected purposes.",Winter Fuel Allowance Payments (Off Gas Grid Claimants) Bill,Commons,1,25
777,A Bill to abolish the Adventure Activities Licensing Authority; and for connected purposes.,Activity Centres (Young Persons' Safety) (Amendment) Bill,Commons,1,24
878,"A Bill to make provision to equalise leave, pay and allowance arrangements for adoptive parents with those of parents whose children are born to them; to equalise eligibility for adoption leave and pay with that of maternity leave and pay; to equalise the rates of pay for the first six weeks of maternity leave and adoption leave; to equalise the entitlement to allowances for self-employed adopters and self-employed mothers; and for connected purposes","Adoption (Leave, Pay and Allowance Arrangements) Bill",Commons,1,24
954,A Bill to require security search arrangements at airports to ensure that appropriate levels of privacy are provided for people with disabilities; and for connected purposes.,Airport Security (People with Disabilities) Bill,Commons,1,24
854,A Bill to introduce measures to reduce the exposure of children to the marketing of alcohol products; to make provision to establish the permitted content of marketing of alcohol products; and for connected purposes,Alcohol Marketing Bill,Commons,1,24
689,A Bill to prohibit the publication of certain information regarding persons who have been arrested until they have been charged with an offence; to set out the circumstances where such information can be published without committing an offence; and for connected purposes.,Anonymity (Arrested Persons) Bill,Commons,1,24
722,A Bill to provide immunity from prosecution or civil action for persons who apprehend or attempt to apprehend burglars; and for connected purposes.,Apprehension of Burglars Bill,Commons,1,24
757,A Bill to require certain public procurement contracts let by public authorities to include a commitment by the contractor to provide apprenticeships and skills training; and for connected purposes.,Apprenticeships and Skills (Public Procurement Contracts) Bill,Commons,1,24
