Bill Id,Long Title,Short Title,Origin_House,Status,SessionID
3785,"A Bill to make provision about absent voting in connection with local government elections in Scotland and Wales, elections to the Scottish Parliament and elections to Senedd Cymru; and for connected purposes.",Absent Voting (Elections in Scotland and Wales) Bill,Commons,1,39
3800,A Bill to require providers of electronic communications networks to grant other such providers access to their apparatus where that is necessary to ensure consistent network coverage; to prevent those providers from charging more than the standard market rate for such access; to require the regulator to impose penalties on providers who unreasonably fail to grant such access; to make provision for the purpose of incentivising providers to allow customers of other providers to use their networks where access cannot be granted to their apparatus; and for connected purposes.,Access to Telecommunications Networks Bill,Commons,1,39
3814,A Bill to prohibit the granting of planning permission in respect of Grade 1 agricultural land; to provide for exemptions from that prohibition in specified circumstances; to place duties on local planning authorities in respect of such land; and for connected purposes.,Agricultural Land (Planning) Bill,Commons,1,39
3790,"A Bill to make provision for and in connection with restricting the importation and non-commercial movement of dogs, cats and ferrets.","Animal Welfare (Import of Dogs, Cats and Ferrets) Bill",Commons,1,39
3798,A Bill to require a person in charge of a dog to take all reasonable steps to ensure that that dog does not fatally injure another dog; and for connected purposes.,Animal Welfare (Responsibility for Dog on Dog Attacks) Bill,Commons,1,39
3811,A Bill to prohibit the use of animals in medical research; to require the use of non-animal methods for conducting medical research; and for connected purposes.,Animals in Medical Research (Prohibition) Bill,Commons,1,39
3858,A Bill to create an offence of disclosing the identity of a person who is the subject of an investigation in respect of the alleged commission of an offence; and for connected purposes.,Anonymity of Suspects Bill,Commons,1,39
3855,A Bill to require the Government to conduct a review of every Arm’s-Length Body in existence on 4 July 2024 and to publish the results of those reviews within four years; and for connected purposes.,Arm’s-Length Bodies (Review) Bill,Commons,1,39
3881,"A Bill to establish, and confer functions on, the Armed Forces Commissioner; to abolish the office of Service Complaints Ombudsman; and for connected purposes.",Armed Forces Commissioner Bill,Commons,1,39
3922,A Bill to make provision for an inquiry into the end use of arms sold to foreign states to determine whether they have been used in violation of international law; to immediately suspend the sale of arms to foreign states where it cannot be demonstrated that arms sold will not be used in violation of international law; and for connected purposes.,Arms Trade (Inquiry and Suspension) Bill,Commons,1,39
3890,A Bill to make provision about the accessibility of air travel for disabled passengers; to make provision about the powers of the Civil Aviation Authority to enforce accessibility requirements; to remove the limit on compensation for damage to wheelchairs or other mobility equipment on domestic flights; and for connected purposes.,Aviation (Accessibility) Bill,Commons,1,39
3848,A Bill to set maximum time limits within which a bailiff’s warrant of possession appointment date must be granted; to make provision for alternative methods of executing warrants of possession; and for connected purposes.,Bailiffs (Warrants of Possession) Bill,Commons,1,39
3844,A Bill to make provision for penalties against the Court of Directors of the Bank of England for failure to meet inflation targets.,Bank of England (Inflation Targets) Bill,Commons,1,39
3806,A Bill to make fire and rescue authorities statutory consultees for planning applications relating to Battery Energy Storage Systems; and for connected purposes.,Battery Energy Storage Systems (Fire Safety) Bill,Commons,1,39
3865,A Bill to de-criminalise the non-payment of the BBC licence fee by persons aged over seventy-five; and for connected purposes.,BBC Licence Fee Non-Payment (Decriminalisation for Over-75s) Bill,Commons,1,39
3805,"A Bill to require specified organisations and public bodies to inform children and young people of local, national and online support services available to them following a bereavement; and for connected purposes.",Bereavement Support (Children and Young People) Bill,Commons,1,39
3929,"A Bill to make provision about border security; to make provision about immigration and asylum; to make provision about sharing customs data and trailer registration data; to make provision about articles for use in serious crime; to make provision about serious crime prevention orders; to make provision about fees paid in connection with the recognition, comparability or assessment of qualifications; and for connected purposes.","Border Security, Asylum and Immigration Bill",Commons,1,39
3903,"A Bill to require the Secretary of State to review the current arrangements for breast cancer screening, including the potential merits of reducing the minimum age at which women are invited for regular breast cancer screening and of increasing the use of automated breast ultrasound; and for connected purposes.",Breast Cancer Screening (Review) Bill,Commons,1,39
3863,A Bill to make provision for the privatisation of the British Broadcasting Corporation; and for connected purposes.,British Broadcasting Corporation (Privatisation) Bill,Commons,1,39
3835,A Bill to set minimum standards for the building of new homes in relation to quality and energy efficiency; to place requirements on developers of new homes; and for connected purposes.,Building Regulations (Minimum Standards) Bill,Commons,1,39
3905,A Bill to require the installation of swift bricks on new buildings; and for connected purposes.,Building Regulations (Swift Bricks) Bill,Commons,1,39
3807,"A Bill to provide for a statutory definition of bullying at work; to make provision relating to bullying at work, including to enable claims relating to workplace bullying to be considered by an employment tribunal; to provide for a Respect at Work Code to set minimum standards for positive and respectful work environments; to give powers to the Equalities and Human Rights Commission to investigate workplaces and organisations where there is evidence of a culture of, or multiple incidents of, bullying and to take enforcement action; and for connected purposes.",Bullying and Respect at Work Bill,Commons,1,39
3842,"A Bill to place a duty on the Government to ensure that every town with a population of more than 10,000 people has a regular bus service operating seven days a week, and that local health services, including hospitals and GP surgeries, are served by those buses; and for connected purposes.",Bus Services Bill,Commons,1,39
3861,A Bill to exempt motor homes from caravan site licensing requirements; and for connected purposes.,Caravan Site Licensing (Exemptions of Motor Homes) Bill,Commons,1,39
3904,A Bill to require new buildings to meet net zero standards for embodied and operational carbon emissions; and for connected purposes.,Carbon Emissions from Buildings (Net Zero) Bill,Commons,1,39
3841,"A Bill to require the Secretary of State to publish and implement a Care Workers Employment Strategy, with the aim of improving the recruitment and retention of care workers; to establish an independent National Care Workers Council with responsibility for setting professional standards for care workers, for establishing a system of professional qualifications and accreditation for care workers, and for advising the Government on those matters; to require the Secretary of State to commission an independent assessment of the support available to unpaid carers, including financial support and employment rights; and for connected purposes.",Carers and Care Workers Bill,Commons,1,39
3823,"A Bill to provide for a category of protection for chalk streams for the purpose of providing additional protections from pollution, abstraction and other forms of environmental damage; and for connected purposes.",Chalk Streams (Protection) Bill,Commons,1,39
3845,A Bill to create an offence of child criminal exploitation; and for connected purposes.,Child Criminal Exploitation Bill,Commons,1,39
3885,A Bill to create an offence of child criminal exploitation; and for connected purposes.,Child Criminal Exploitation (No. 2) Bill,Commons,1,39
3812,A Bill to make provision about the maintenance of registers by local authorities of children in their area who are not full-time pupils at any school; to make provision about support by local authorities to promote the education of such children; to make provision about school attendance orders; and for connected purposes.,"Children Not in School (Registers, Support and Orders) Bill",Commons,1,39
3864,A Bill to extend the definition of children’s clothing for the purposes of exemption from VAT; to extend the VAT exemption to further categories of school uniform; and for connected purposes.,Children’s Clothing (Value Added Tax) Bill,Commons,1,39
3875,A Bill to require the Secretary of State to conduct a review of the funding of hospices specialising in the care of children and to publish proposals for measures to guarantee access to hospices for all children who require palliative care; and for connected purposes.,Children’s Hospices (Funding) Bill,Commons,1,39
3909,A Bill to make provision about the safeguarding and welfare of children; about support for children in care or leaving care; about regulation of care workers; about regulation of establishments and agencies under Part 2 of the Care Standards Act 2000; about employment of children; about breakfast club provision and school uniform; about attendance of children at school; about regulation of independent educational institutions; about inspections of schools and colleges; about teacher misconduct; about Academies and teachers at Academies; repealing section 128 of the Education Act 2002; about school places and admissions; about establishing new schools; and for connected purposes.,Children’s Wellbeing and Schools Bill,Commons,1,39
3936,A bill to Make provision for persons of the Roman Catholic faith to be eligible to hold the office of His Majesty’s High Commissioner to the General Assembly of the Church of Scotland.,Church of Scotland (Lord High Commissioner) Bill,Commons,1,39
3896,A Bill to make provision for the repeal of legislation relating to Billingsgate Market and the London Central Markets; and for connected purposes.,City of London (Markets) Bill,Commons,1,39
3776,A Bill to require the United Kingdom to achieve climate and nature targets; to give the Secretary of State a duty to implement a strategy to achieve those targets; to establish a Climate and Nature Assembly to advise the Secretary of State in creating that strategy; to give duties to the Committee on Climate Change and the Joint Nature Conservation Committee regarding the strategy and targets; and for connected purposes.,Climate and Nature Bill,Commons,1,39
3840,"A Bill to require the Secretary of State to publish proposals for a Climate Finance Fund, to be funded via a levy on fossil fuel companies and other organisations that contribute to pollution; and for connected purposes.",Climate Finance Fund (Fossil Fuels and Pollution) Bill,Commons,1,39
3918,A Bill to require the Secretary of State to conduct a review of the contribution of community energy to the Government’s Clean Power 2030 mission.,Community Energy (Review) Bill,Commons,1,39
3794,A Bill to amend section 172 of the Companies Act 2006 to require company directors to balance their duty to promote the success of the company with duties in respect of the environment and the company’s employees.,Company Directors (Duties) Bill,Commons,1,39
3925,A Bill to make provision for a right to consular assistance for British journalists abroad who have been detained or held hostage; and for connected purposes.,Consular Assistance  (Journalists) Bill,Commons,1,39
3782,A Bill to change the procedure for amending Schedule 2 to the Misuse of Drugs Act 1971.,Controlled Drugs (Procedure for Specification) Bill,Commons,1,39
3818,A Bill to allow for certain civil and family court hearings to be conducted remotely.,Courts (Remote Hearings) Bill,Commons,1,39
3817,A Bill to require the Secretary of State to establish an independent review of disablement caused by Covid-19 vaccinations and the adequacy of the compensation offered to persons so disabled; and for connected purposes.,Covid-19 Vaccine Damage Bill,Commons,1,39
3852,"A Bill to place a duty on the Secretary of State to make provision about financial assistance to persons who have suffered disablement following vaccination against Covid-19 and to the next of kin of persons who have died shortly after vaccination against Covid-19; to require the Secretary of State to report to Parliament on the merits of a no-fault compensation scheme to provide such financial assistance, on whether there should be any upper limit on the financial assistance available, on the criteria for eligibility and on whether payment should be made in all cases where there is no other reasonable cause for the death or disablement suffered; to provide for a special time limit under the Limitation Act 1980 for actions in respect of personal injury or death following a Covid-19 vaccination; and for connected purposes.",Covid-19 Vaccine Damage Payments Bill,Commons,1,39
3938,"A Bill to make provision about anti-social behaviour, offensive weapons, offences against people (including sexual offences), property offences, the criminal exploitation of persons, sex offenders, stalking and public order; to make provision about powers of the police, the border force and other similar persons; to make provision about confiscation; to make provision about the police; to make provision about terrorism and national security, and about international agreements relating to crime; to make provision about the criminal liability of bodies; and for connected purposes.",Crime and Policing Bill,Commons,1,39
3854,"A Bill to provide that, before making any order to designate a type of dog for the purposes of section 1 or 2 of the Dangerous Dogs Act 1991, the Secretary of State must carry out a public consultation and publish a comparative review of data showing the incidences of fatalities resulting from bites of dogs of that type in the last three years.",Dangerous Dogs Act 1991 (Amendment) Bill,Commons,1,39
3889,A Bill to make provision for or in connection with the relief of debts of certain developing countries.,Debt Relief (Developing Countries) Bill,Commons,1,39
3799,A Bill to amend the Scotland Act 1998 to grant legislative competence to the Scottish Parliament in respect of immigration.,Devolution (Immigration) (Scotland) Bill,Commons,1,39
3821,"A Bill to make provision changing the law about the offence of livestock worrying, including changes to what constitutes an offence and increased powers for investigation of suspected offences; and for connected purposes.",Dogs (Protection of Livestock) (Amendment) Bill,Commons,1,39
3828,"A Bill to make provision changing the law about the offence of livestock worrying, including changes to what constitutes an offence and increased powers for investigation of suspected offences; and for connected purposes.",Dogs (Protection of Livestock) (Amendment) (No. 2) Bill,Commons,1,39
3902,A Bill to create certain domestic abuse aggravated offences; and for connected purposes.,Domestic Abuse (Aggravated Offences) Bill,Commons,1,39
3915,A Bill to make provision for an entitlement to paid safe leave for victims of domestic abuse; and for connected purposes.,Domestic Abuse (Safe Leave) Bill,Commons,1,39
3808,A Bill to make provision about consumer protection in relation to domestic building works; and for connected purposes.,Domestic Building Works (Consumer Protection) Bill,Commons,1,39
3859,"A Bill to exempt from VAT supplies of electricity, oil and gas for domestic purposes; and for connected purposes.",Domestic Energy (Value Added Tax) Bill,Commons,1,39
3820,A Bill to require specified educational institutions to develop and maintain a mental health policy; and for connected purposes.,Educational Institutions (Mental Health Policy) Bill,Commons,1,39
3926,"A Bill to require the provision of audio and tactile measures at polling stations for the purpose of enabling blind voters to vote independently and in secret; to require the Secretary of State to take steps to identify, develop and implement new accessible voting solutions for blind voters; to require the Secretary of State to undertake a review of the arrangements for postal voting in respect of accessibility for blind voters and to implement any recommendations of that review; and for connected purposes;",Elections (Accessibility for Blind Voters) Bill,Commons,1,39
3900,A Bill to introduce a system of proportional representation for parliamentary elections and for local government elections in England; and for connected purposes.,Elections (Proportional Representation) Bill,Commons,1,39
3737,"A Bill to make provision to amend the law relating to employment rights; to make provision about procedure for handling redundancies; to make provision about the treatment of workers involved in the supply of services under certain public contracts; to provide for duties to be imposed on employers in relation to equality; to provide for the establishment of the School Support Staff Negotiating Body and the Adult Social Care Negotiating Body; to amend the Seafarers’ Wages Act 2023; to make provision for the implementation of international agreements relating to maritime employment; to make provision about trade unions, industrial action, employers’ associations and the functions of the Certification Officer; to make provision about the enforcement of legislation relating to the labour market; and for connected purposes.",Employment Rights Bill,Commons,1,39
3813,A Bill to amend Section 50 of the Employment Rights Act 1996 to add Special Constables to the list of those granted the right to take time off work to perform their duties.,Employment Rights (Special Constables) Bill,Commons,1,39
3898,A Bill to require the Secretary of State to commission and publish a review of the legislation and guidance relating to e-scooters; to place a duty on the Secretary of State to promote public awareness of legislation relating to the use of e-scooters; and for connected purposes.,E-scooters (Review and Awareness) Bill,Commons,1,39
3780,A Bill to make provision to modify the effect on domestic law of arrangements relating to the withdrawal of the United Kingdom from the EU; and for connected purposes.,European Union (Withdrawal Arrangements) Bill,Commons,1,39
3847,A Bill to exempt from Value Added Tax repairs to listed places of worship; and for connected purposes.,Exemption from Value Added Tax (Listed Places of Worship) Bill,Commons,1,39
3856,"A Bill to exempt from Value Added Tax goods or services which are beneficial to the environment, to health and safety, to education or for charitable purposes.",Exemption from Value Added Tax (Miscellaneous Provisions) Bill,Commons,1,39
3849,A Bill to exempt from Value Added Tax the supply of electricity at public electric vehicle charging points; and for connected purposes.,Exemption from Value Added Tax (Public Electric Vehicle Charging Points) Bill,Commons,1,39
3873,A Bill to make provision about finance.,Finance Bill,Commons,1,39
3877,A Bill to create an offence of possessing a blueprint for the production of a firearm by 3D printing; to create an offence of possessing part of a firearm produced by 3D printing; and for connected purposes.,Firearms (3D Printing) Bill,Commons,1,39
3791,A Bill to make provision about the sale of fireworks; and for connected purposes.,Fireworks Bill,Commons,1,39
3833,A Bill to require the Secretary of State to publish proposals for measures to address gender inequality in football.,Football (Gender Inequality) Bill,Commons,1,39
3781,A Bill to make provision about the automatic registration of all children eligible for free school meals; to provide for an opt-out where the family wishes; and for connected purposes.,Free School Meals (Automatic Registration of Eligible Children) Bill,Commons,1,39
3789,A Bill to prohibit the import and sale of fur; and for connected purposes.,Fur (Import and Sale) Bill,Commons,1,39
3792,A Bill to remove monetary limits on proceeds from the mandatory conditions of lottery operating licences; and for connected purposes.,Gambling Act 2005 (Monetary Limits for Lotteries) Bill,Commons,1,39
3738,A Bill to make provision about Great British Energy.,Great British Energy Bill,Commons,1,39
3871,A Bill to establish a national register of Green Belt land in England; to restrict the ability of local authorities to de-designate Green Belt land; to make provision about future development of de-designated Green Belt land; and for connected purposes.,Green Belt (Protection) Bill,Commons,1,39
3819,"A Bill to define the term “green spaces” to include urban parks, neighbourhood areas, and significant natural landscapes; to establish a Government Office for Green Spaces and to make provision about the powers and duties of that Office in relation to local authorities and public bodies; to require that Office to advise the Government on the preservation, enhancement, and accessibility of green spaces; to make provision about the promotion of community involvement in protection of green spaces; and for connected purposes.",Green Spaces Bill,Commons,1,39
3816,"A Bill to amend the Health and Safety at Work etc. Act 1974 to place a requirement on employers to take proactive measures to prevent violence and harassment in the workplace; to make provision for protections for women and girls in the workplace; and to require the Health and Safety Executive to publish a Health and Safety Framework on violence and harassment in the workplace, including violence against women and girls in the workplace.",Health and Safety at Work etc. Act 1974 (Amendment) Bill,Commons,1,39
3846,A Bill to provide for exemptions from insurance premium tax in respect of health insurance; and for connected purposes.,Health Insurance (Exemption from Insurance Premium Tax) Bill,Commons,1,39
3834,A Bill to require local authorities to maintain a register of heritage public houses in their area and to make provision in connection with the compilation and maintenance of such registers; to make provision relating to planning applications in respect of public houses on such a register; to place restrictions on the sale of heritage public houses; to make provision relating to the nomination of heritage public houses as assets of community value; to make provision about the listing of heritage public houses; and for connected purposes.,Heritage Public Houses Bill,Commons,1,39
3094,"A Bill to make provision for a railway between a junction with Phase 2a of High Speed 2 south of Crewe in Cheshire and Manchester Piccadilly Station; for a railway between Hoo Green in Cheshire and a junction with the West Coast Main Line at Bamfurlong, south of Wigan; and for connected purposes.",High Speed Rail (Crewe - Manchester) Bill,Commons,1,36
3851,A Bill to amend section 58 of the Highways Act 1980 to restrict the defences available to highway authorities; and for connected purposes.,Highways Act 1980 (Amendment) Bill,Commons,1,39
3421,A Bill to make provision for expenditure by the Secretary of State and the removal of restrictions in respect of certain land for or in connection with the construction of a Holocaust Memorial and Learning Centre.,Holocaust Memorial Bill,Commons,1,37
3801,A Bill to make provision about the duties of public bodies to prevent homelessness.,Homelessness Prevention Bill,Commons,1,39
3886,A Bill to provide for the prohibition of the sale in England of horticultural peat by the end of 2025; to provide for certain exemptions from that prohibition; and for connected purposes.,Horticultural Peat (Prohibition of Sale) Bill,Commons,1,39
3797,"A Bill to require the Secretary of State to publish proposals for the funding of hospice clinical services by NHS England; to require the Secretary of State to report to Parliament on the potential merits of including pharmacy, pathology, patient community equipment, palliative consultant costs, clinical nurse specialist services, and advance care planning costs within the NHS funding framework; and for connected purposes.",Hospices and Health Care (Report on Funding) Bill,Commons,1,39
3755,A Bill to remove the remaining connection between hereditary peerage and membership of the House of Lords; to abolish the jurisdiction of the House of Lords in relation to claims to hereditary peerages; and for connected purposes.,House of Lords (Hereditary Peers) Bill,Commons,1,39
3943,A Bill to make provision for a right to manage for freeholders on unadopted private or mixed-use housing estates; to set minimum standards for public amenities on new housing estates; to make provision about the enforcement of those standards; to make provision about the adoption by local authorities of public amenities on new housing estates; and for connected purposes.,Housing Estates Bill,Commons,1,39
3809,A Bill to make provision prohibiting the import of hunting trophies into Great Britain.,Hunting Trophies (Import Prohibition) Bill,Commons,1,39
