Bill Id,Long Title,Short Title,Origin_House,Status,SessionID
2237,A Bill to make provision for the marriage of same sex couples in Northern Ireland; to make provision in the law of Northern Ireland for the conversion of civil partnerships to marriages and for the review of civil partnership; to make provision for the legal recognition of the marriage of armed forces personnel overseas and of other marriages solemnised outside Northern Ireland; and for connected purposes.,Marriage (Same Sex Couples) (Northern Ireland) (No.2) Bill,Commons,1,30
2317,A Bill to require the person registering a marriage or civil partnership to attest the valid consent of both parties to the marriage or civil partnership before it is solemnized; and for connected purposes.,Marriage and Civil Partnership (Consent) Bill,Commons,1,30
2290,A Bill to raise the minimum age of consent to marriage or civil partnership to eighteen; and for connected purposes.,Marriage and Civil Partnership (Minimum Age) Bill,Commons,1,30
2319,"A Bill to require banks to provide cash machines to be made available on designated streets; to enable local authorities to designate streets that require cash machines in towns of more than 5,000 residents; and for connected purposes",Minimum Service Obligation (High Street Cashpoints) Bill,Commons,1,30
2112,A Bill to require the use of published criteria to determine whether mobile homes and park homes are liable for council tax or non-domestic rates; to make provision in relation to the residential status of such homes; to amend the Mobile Home Acts; and for connected purposes.,Mobile Homes and Park Homes Bill,Commons,1,30
2202,"A Bill to make provision about multi-employer pension schemes, including provision for the protection of unincorporated businesses, such as plumbing businesses, from certain multi-employer pension scheme liabilities; and for connected purposes.",Multi-employer Pension Schemes Bill,Commons,1,30
2322,A Bill to establish environmental standards for nappies; to make provision about the advertising and promotion of nappies with regard to those standards; and for connected purposes.,Nappies (Environmental Standards) Bill,Commons,1,30
2282,A Bill to re-establish the Secretary of State’s legal duty as to the National Health Service in England and to make provision about the other duties of the Secretary of State in that regard; to make provision for establishing Integrated Health Boards and about the administration and accountability of the National Health Service in England; to make provision about ending private finance initiatives in the National Health Service in England; to exclude the National Health Service from international trade agreements; to repeal sections 38 and 39 of the Immigration Act 2014; and for connected purposes.,National Health Service Bill,Commons,1,30
2088,A Bill to make provision for co-funding and for the extension of co-payment for NHS services in England; and for connected purposes.,National Health Service (Co-Funding and Co-Payment) Bill,Commons,1,30
2358,A Bill to prohibit the use of fax machines and pagers by National Health Service bodies; and for connected purposes.,National Health Service (Prohibition of Fax Machines and Pagers) Bill,Commons,1,30
2070,A Bill to extend the National Living Wage to people aged 18 to 24.,National Living Wage (Extension to Young People) Bill,Commons,1,30
2420,"To make provision to change the dates on which non-domestic rating lists must be
compiled; and for connected purposes.",Non-Domestic Rating (Lists) Bill,Commons,1,30
2149,A Bill to make provision about the restructuring of urgent care facilities in North Northamptonshire; and for connected purposes.,North Northamptonshire (Urgent Care Facilities) Bill,Commons,1,30
2150,A Bill to require the merging of the Nene Valley and Corby Clinical Commissioning Groups; and for connected purposes.,Northamptonshire Clinical Commissioning Groups (Merger) Bill,Commons,1,30
2428,"A Bill to require the Government to prepare a strategy for recycling out-of-service Royal Navy nuclear submarines and to report annually on progress, to consult on extending decommissioning powers in Part 1 of the Energy Act 2004 to include the recycling of Royal Navy nuclear submarines, and to publish estimates of the taxpayer liability associated with such submarines; and for connected purposes.",Nuclear Submarine Recycling (Reporting) Bill,Commons,1,30
2459,A Bill to make provision about National Health Service bodies establishing nurse staffing levels.,Nurse Staffing Levels Bill,Commons,1,30
2293,A Bill to make administrators and moderators of certain online forums responsible for content published on those forums; to require such administrators and moderators to remove certain content; to require platforms to publish information about such forums; and for connected purposes.,Online Forums Bill,Commons,1,30
2368,A Bill to regulate online news platforms; and for connected purposes.,Online News Platforms (Regulation) Bill,Commons,1,30
2144,A Bill to make provision about public awareness measures in respect of the symptoms of and screening for ovarian cancer; and for connected purposes.,Ovarian Cancer (Public Awareness) Bill,Commons,1,30
2075,A Bill to make provision extending the basis on which British citizens outside the UK qualify to participate in parliamentary elections; and for connected purposes.,Overseas Electors Bill,Commons,1,30
2263,"A Bill to require producers of packaging products to assume responsibility for the collection, transportation, recycling, disposal, treatment and recovery of those products; and for connected purposes.",Packaging (Extended Producer Responsibility) Bill,Commons,1,30
2316,A Bill to make provision in connection with the recognition of the State of Palestine.,Palestinian Statehood (Recognition) Bill,Commons,1,30
2424,A Bill to extend entitlements to parental leave for parents of babies born prematurely or requiring neonatal care; and for connected purposes.,Parental Leave (Premature and Sick Babies) Bill,Commons,1,30
2257,"A Bill to require employers with more than 250 employees to publish information about parental leave, and pay in the course of such leave; and for connected purposes.",Parental Leave and Pay Arrangements (Publication) Bill,Commons,1,30
2386,A Bill to remove the parental rights of fathers of children conceived through rape; to make provision for an inquiry into the handling by family courts of domestic abuse and violence against women and girls in child arrangement cases; and for connected purposes.,Parental Rights (Rapists) and Family Courts Bill,Commons,1,30
2140,A Bill to prohibit members of the House of Commons who do not take the oath from receiving parliamentary allowances; and for connected purposes.,Parliamentary Allowances (Restriction) Bill,Commons,1,30
2061,To amend the Parliamentary Constituencies Act 1986 to make provision about the number and size of parliamentary constituencies in the United Kingdom; and for connected purposes.,Parliamentary Constituencies (Amendment) Bill,Commons,1,30
2201,A Bill to provide for the regulation of the carrying of passengers in Greater London by pedal cycles and power-assisted pedal cycles for hire or reward; and for connected purposes,Pedicabs (London) Bill,Commons,1,30
2193,"A Bill to require pension providers to make lump sum payments and other pension benefits available to people with ill health, including people with a terminal diagnosis, prior to such people reaching minimum pension age; and for connected purposes.",Pension Benefits (Ill Health) Bill,Commons,1,30
2401,A Bill to require pension providers to publish standardised information on charges for pension products; to make provision for a cap on such charges; and for connected purposes.,Pension Charges Bill,Commons,1,30
2147,A Bill to establish a review of pension arrangements for women affected by changes made by the Pensions Act 1995 and the Pensions Act 2011; and for connected purposes.,Pensions (Review of Women’s Arrangements) Bill,Commons,1,30
2156,A Bill to establish a review of pension arrangements for women affected by changes made by the Pensions Act 1995 and the Pensions Act 2011; to require the review in particular to undertake costings for a compensation scheme and consider the operation of section 1(4) of the Pensions Act 2011; and for connected purposes.,Pensions (Review of Women's Arrangements) (No. 2) Bill,Commons,1,30
2277,A Bill to amend the Animal Welfare Act 2006 and the Animal Health and Welfare (Scotland) Act 2006 to make the theft of pets an offence; to apply certain post-conviction powers under those Acts to such an offence; and for connected purposes.,Pets (Theft) Bill,Commons,1,30
2069,A Bill to make provision for the regulation of physician associates; to make physician associate a protected title; and for connected purposes.,Physician Associates (Regulation) Bill,Commons,1,30
2146,A Bill to create a pilot licensing system in line with International Civil Aviation Organization standards; and for connected purposes.,Pilot (Licensing) Bill,Commons,1,30
2361,A Bill to define affordable housing in relation to household incomes; to amend the law relating to land valuation and compensation; and for connected purposes.,Planning (Affordable Housing and Land Compensation) Bill,Commons,1,30
2198,A Bill to require specified planning controls in relation to developments likely to be affected by existing noise sources; and for connected purposes.,Planning (Agent of Change) Bill,Commons,1,30
2323,A Bill to limit the grounds of appeal against decisions on planning applications consistent with a neighbourhood development plan or local plan; and for connected purposes,Planning (Appeals) Bill,Commons,1,30
2355,A Bill to set targets for the reduction of plastic pollution; to require the Secretary of State to publish a strategy and annual reports on plastic pollution reduction; to establish an advisory committee on plastic pollution; and for connected purposes.,Plastic Pollution Bill,Commons,1,30
2438,,Plastic Pollution (No. 2) Bill,Commons,1,30
2246,"A Bill to require the Secretary of State to set, measure, enforce and report on targets for the reduction and recycling of plastic packaging; to require that such targets following the United Kingdom’s withdrawal from the European Union at least match such targets set by the European Union; to establish enforcement mechanisms in respect of such targets and associated provisions; to make provision for support for the development of sustainable alternatives to plastic packaging; and for connected purposes.",Plastics Bill,Commons,1,30
2398,A Bill to require police forces to train police officers in autism awareness; and for connected purposes.,Police Officer Training (Autism Awareness) Bill,Commons,1,30
2211,A Bill to make provision about postal voting at elections.,Postal Voting Bill,Commons,1,30
2367,A Bill to require routine six week National Health Service check-ups for new mothers to include mental health assessments and advice; and for connected purposes.,Postnatal Check-ups (Mental Health) Bill,Commons,1,30
2404,"A Bill to prohibit making employees redundant during pregnancy, maternity leave and the period of six months from the end of pregnancy; and for connected purposes.",Pregnancy and Maternity (Redundancy Protection) Bill,Commons,1,30
2130,A Bill to impose duties on the Prime Minister relating to accountability to the House of Commons; to require the Prime Minister to be available to answer questions in that House on at least two occasions during a sitting week except in specified circumstances; and for connected purposes.,Prime Minister (Accountability to House of Commons) Bill,Commons,1,30
2380,A Bill to require a Prime Minister to tender their resignation to Her Majesty if the House of Commons passes a motion of no confidence in them; and for connected purposes.,Prime Minister (Confidence) Bill,Commons,1,30
2441,A Bill To make provision for the House of Commons to nominate the Prime Minister and approve appointments to the Cabinet; to establish the office of Acting Prime Minister; and for connected purposes.,Prime Minister (Nomination) and Cabinet (Appointment) Bill,Commons,1,30
2127,"A Bill to make provision for the carrying out of the functions of the Prime Minister in the event that a Prime Minister, or a person temporarily carrying out the functions of the Prime Minister, is incapacitated; and for connected purposes.",Prime Minister (Temporary Replacement) Bill,Commons,1,30
2090,A Bill to prohibit principal local authorities being abolished in the absence of the authority of its elected councillors and a local referendum; and for connected purposes.,Principal Local Authorities (Grounds for Abolition) Bill,Commons,1,30
2238,A Bill to make provision about substance testing in prisons and similar institutions.,Prisons (Substance Testing) Bill,Commons,1,30
2200,A Bill to require all private landlords in England to be registered; and for connected purposes.,Private Landlords (Registration) Bill,Commons,1,30
2245,A Bill to make provision about the protection of pollinators; and for connected purposes.,Protection of Pollinators Bill,Commons,1,30
2443,"A Bill to establish a public advocate to provide advice to, and act as data controller for, representatives of the deceased after major incidents.",Public Advocate Bill,Commons,1,30
2458,"A Bill to establish an independent advisory body to make recommendations on the equitable distribution of public expenditure across the United Kingdom, the calculation of block grants to devolved administrations, the implications of the devolution of tax-raising powers for the United Kingdom fiscal framework, and the resolution of fiscal disputes arising between governments in the United Kingdom; and for connected purposes.",Public Expenditure and Taxation (Advisory Body) Bill,Commons,1,30
2079,A Bill to limit exit payments made by public sector organisations to employees; and for connected purposes.,Public Sector Exit Payments (Limitation) Bill,Commons,1,30
2333,A Bill to require public authorities to pay certain suppliers using project bank accounts; and for connected purposes.,Public Sector Supply Chains (Project Bank Accounts) Bill,Commons,1,30
2084,A Bill to make provision for the privatisation of the British Broadcasting Corporation and Channel 4; and for connected purposes.,Public Service Broadcasters (Privatisation) Bill,Commons,1,30
2105,"A Bill to make provision about the availability of public services during weekday evenings, at weekends and on bank holidays; and for connected purposes.",Public Services (Availability) Bill,Commons,1,30
2278,A Bill to make provision for a single compensation scheme for passengers across train operators; to require train operators to pay automatic compensation to season ticket holders and certain other passengers where certain standards of service are not met; to allow train operators to recover compensation paid to passengers from Network Rail in certain circumstances; to establish a body to administer rail compensation; and for connected purposes.,Rail Passenger (Compensation) Bill,Commons,1,30
2297,A Bill to require the Secretary of State to terminate a rail passenger services franchise agreement in certain circumstances; to repeal section 25 of the Railways Act 1993; to make provision for local franchising authorities in England; and for connected purposes.,Railways (Franchises) Bill,Commons,1,30
2072,A Bill to make provision for leave to enter or remain in the United Kingdom to be granted to the family members of refugees and of people granted humanitarian protection; to provide for legal aid to be made available for such family reunion cases; and for connected purposes.,Refugees (Family Reunion) (No. 2) Bill,Commons,1,30
2175,A Bill to make provision about the registration of marriages.,Registration of Marriage (No. 2) Bill,Commons,1,30
2266,A Bill to provide for the representation of Gibraltar by a Member of the House of Commons; and for connected purposes,Representation of the People (Gibraltar) Bill,Commons,1,30
2074,A Bill to reduce the voting age to 16 in parliamentary and other elections; to make provision about young people's education in citizenship and the constitution; and for connected purposes.,Representation of the People (Young People's Enfranchisement and Education) Bill,Commons,1,30
2068,A Bill to reduce the voting age to 16 in parliamentary and other elections; to make provision for auto-enrolment onto the electoral register for people aged 16 to 24; to make provision about the use of educational establishments as polling stations; and for connected purposes.,Representation of the People (Young People's Enfranchisement) Bill,Commons,1,30
2447,A Bill to grant the Environment Agency additional powers to require water companies to manage reservoirs to mitigate flood risk; and for connected purposes.,Reservoirs (Flood Risk) Bill,Commons,1,30
2217,A Bill to make provision about rivers authorities; to make provision about the expenses of internal drainage boards; and for connected purposes.,Rivers Authorities and Land Drainage Bill,Commons,1,30
2243,"A Bill to make provision about the surrender, production or other delivery up of driving licences, or test certificates, in relation to certain offences; to make provision in relation to identifying persons in connection with fixed penalty notices, conditional offers and the payment of fixed penalties under the Road Traffic Offenders Act 1988; and for connected purposes.",Road Traffic Offenders (Surrender of Driving Licences etc.) (No. 2) Bill,Commons,1,30
2188,"A Bill to enable the Secretary of State to refuse entry, or to vary or curtail leave to enter or remain already granted, to a person who is a non-UK or non-EEA national who is known to be, or to have been, involved in gross human rights abuses or in certain acts of corruption; to make provision for financial sanctions against a person who is a non-UK or non-EEA national who is known to be, or to have been, involved in gross human rights abuses or in certain acts of corruption; and for connected purposes.",Sanctions (Human Rights Abuse and Corruption) Bill,Commons,1,30
2448,"A Bill to amend the Requirements for School Food Regulations 2014 to further restrict the serving of foods high in fat, salt or sugar in schools and to require all school meals to be free of added sugar by 2022; to require all publicly-funded schools to adhere to those standards; and for connected purposes.",School Food Bill,Commons,1,30
2152,A Bill to require local authorities to facilitate the delivery of programmes that provide free meals and activities for children during school holidays; and for connected purposes.,School Holidays (Meals and Activities) Bill,Commons,1,30
2365,A Bill to require school uniform policies to be gender-neutral; and for connected purposes.,School Uniform (Gender Neutrality) Bill,Commons,1,30
2309,A Bill to require school governing bodies to implement affordability policies when setting school uniform requirements; and for connected purposes.,School Uniforms Bill,Commons,1,30
2099,A Bill to enable schools to select pupils on the basis of published criteria; to allow schools to determine maximum class sizes; to remove restrictions on the expansion of the number of pupils in schools and on the creation of new schools; and for connected purposes.,Schools Bill,Commons,1,30
2187,"A Bill to make it an offence to attack service animals, including police dogs and horses; to make certain offences aggravated when perpetrated against such animals; and for connected purposes.",Service Animals (Offences) Bill,Commons,1,30
2212,"A Bill to make provision about shared parental leave and pay for workers, including those that are self-employed; and for connected purposes",Shared Parental Leave and Pay (Extension) Bill,Commons,1,30
2190,A Bill to require householders to notify local authorities of an intention to register accommodation for short or holiday lets; and for connected purposes.,Short and Holiday-Let Accommodation (Notification of Local Authorities) Bill,Commons,1,30
2378,A Bill to make it an offence to use a sky lantern; and for connected purposes.,Sky Lanterns (Prohibition) Bill,Commons,1,30
2343,A Bill to prohibit smoking on National Health Service premises; and for connected purposes.,Smoking Prohibition (National Health Service Premises) Bill,Commons,1,30
2249,To amend the law relating to the Social Mobility Commission.,Social Justice Commission Bill,Commons,1,30
2216,A Bill to make social media service providers liable for online publications in respect of civil proceedings in specified circumstances; to establish and confer functions upon a commissioner for online safety; to make provision about the disclosure of certain information by social media service providers; and for connected purposes.,Social Media Service Providers (Civil Liability and Oversight) Bill,Commons,1,30
2119,A Bill to prohibit permanent derogations from a 30 mile per hour speed limit in built-up areas in England; to make provision for the circumstances in which speed limits below 30 miles per hour may be introduced; and for connected purposes.,Speed Limits (England) Bill,Commons,1,30
2116,A Bill to make provision for the reduction of stamp duty rates on residential property.,Stamp Duty Bill,Commons,1,30
2115,A Bill to make provision about the forgiveness or discharge of student loan debt in certain circumstances; to make provision about the treatment of student loan debt in bankruptcy proceedings; and for connected purposes.,Student Loans (Debt Discharge) Bill,Commons,1,30
2080,A Bill to limit the rate of interest chargeable on outstanding student loan debt; and for connected purposes.,Student Loans (Debt Interest) Bill,Commons,1,30
2113,A Bill to make the breach of certain rules relating to sub-letting rented accommodation a criminal offence; to make provision for criminal sanctions in respect of unauthorised sub-letting; and for connected purposes.,Sublet Property (Offences) Bill,Commons,1,30
2227,A Bill to make provision about supervised drug consumption facilities; to make it lawful to take controlled substances within such facilities in specified circumstances; and for connected purposes,Supervised Drug Consumption Facilities Bill,Commons,1,30
2086,"A Bill to require the Government to publish an annual review of the net yield to HM Treasury of tax rates and duties levied, including estimates of the impact on yield of changes to rates of those taxes and duties; and for connected purposes.",Tax Rates and Duties (Review) Bill,Commons,1,30
2371,"A Bill to establish a single custodial tenancy deposit scheme; to provide for that scheme to invest deposits; to require interest on such investments to be used for the provision of tenant advocacy, tenant support and arbitration services; to establish a mandatory arbitration service for the resolution of disputes between landlords and tenants; and for connected purposes.",Tenancy (Deposits and Arbitration) Bill,Commons,1,30
2253,"A Bill to require the provision of comprehensive palliative care to those with terminal illnesses, including adults over the age of 60; to require certain public bodies to co-operate with hospices in the provision of palliative care; to make provision for support for those caring for individuals with a terminal illness; and for connected purposes.",Terminal Illness (Provision of Palliative Care and Support for Carers) Bill,Commons,1,30
2154,"A Bill to require the holding of a referendum to endorse the United Kingdom and Gibraltar exit package proposed by HM Government for withdrawal from the EU, or to decide to remain a member, following the completion of formal exit negotiations; and for connected purposes.",Terms of Withdrawal from EU (Referendum) Bill,Commons,1,30
2357,A Bill to require the holding of a referendum in which one option is to approve the withdrawal agreement between the United Kingdom and the European Union and the other option is for the United Kingdom to remain a member of the European Union; and for connected purposes.,Terms of Withdrawal from the EU (Referendum) (No. 2) Bill,Commons,1,30
2451,A Bill to require the Secretary of State to report annually on restrictions on access by UK nationals to Tibet in comparison with other regions of China; to make provision to deny persons involved in imposing such restrictions permission to enter the UK; and for connected purposes.,Tibet (Reciprocal Access) Bill,Commons,1,30
2439,A Bill to require the Coal Authority to undertake remedial works on properties with subsidence damage as a result of tin mining; to make provision for the Coal Authority to make compensation payments in lieu of such works; and for connected purposes.,Tin Mining Subsidence Bill,Commons,1,30
2307,A Bill to require the Secretary of State to report on means of requiring tobacco companies to meet the costs of smoking cessation services; to make provision about the advertising and marketing of products that are alternatives to tobacco; to require tobacco companies to publish information about their activities in relation to such products; to create an offence of selling tobacco without a licence; and for connected purposes.,Tobacco Bill,Commons,1,30
2385,A Bill to require tobacco companies to publish sales and marketing data; and for connected purposes.,Tobacco Companies (Transparency) Bill,Commons,1,30
2272,A Bill to require certain buildings to have toilets which meet the needs of persons with a range of disability and accessibility requirements; and for connected purposes.,Toilets (Provision and Accessibility) Bill,Commons,1,30
