Bill Id,Long Title,Short Title,Origin_House,Status,SessionID
3288,A Bill to make provision about participating in certain court proceedings through live links; and for connected purposes.,Participation in Court Proceedings (Live Links) Bill,Commons,1,37
3290,"A Bill to extend eligibility to paternity leave and pay; to make provision for more flexibility in the timing of, and notice period for, paternity leave; and for connected purposes.",Paternity (Leave and Pay) Bill,Commons,1,37
3433,A Bill to require employers to pay pension contributions into a pension scheme of the employee’s choosing; and for connected purposes.,Pension Contributions Bill,Commons,1,37
3331,A Bill to make provision about the extension of pensions automatic enrolment to jobholders under the age of 22; to make provision about the lower qualifying earnings threshold for automatic enrolment; and for connected purposes.,Pensions (Extension of Automatic Enrolment) Bill,Commons,1,37
3318,A Bill to make provision regarding pets with microchips; and for connected purposes.,Pets (Microchips) Bill,Commons,1,37
3469,A Bill to prevent and punish the theft of dogs and to deter the unlawful importation of certain animals into Great Britain; and for connected purposes.,Pets (Theft and Importation) Bill,Commons,1,37
3434,A Bill to introduce a presumption in planning decision-making against approving quarry development in close proximity to settlements; to require the risks of proposed quarrying sites to the environment and to public health to be assessed as part of the planning process; to provide that the decision on a planning application for quarry development may only be made by the Secretary of State; and for connected purposes.,Planning (Quarries) Bill,Commons,1,37
3372,A Bill to amend the Town and Country Planning Act 1990 to enable local authorities in England to determine the fees to be paid in respect of applications and deemed applications for planning permission; to require local authorities to set the scale of fees with a view to ensuring that the costs of determining applications can be wholly funded by application fees; and for connected purposes.,Planning Application Fees Bill,Commons,1,37
3364,"A Bill to require the Secretary of State to publish a strategy for promoting a circular economy in respect of plastics, including setting targets and measures for the elimination and recycling of single-use plastics; to require the Secretary of State to establish a taskforce to develop proposals to encourage the use of reuse and refill models of packaging; to require the Secretary of State to report annually to Parliament on the implementation of the strategy; to place a duty on the Secretary of State to ensure that UK targets for the elimination and recycling of plastic packaging are more demanding than equivalent targets set by the European Union; to require manufacturers and retailers to pay for the cost of recycling plastic; to require the Government to set annual targets for reducing the quantity of plastic waste that is incinerated; to require the Secretary of State to publish a plan for banning the export of plastic waste by 2027; to make provision for the purpose of reducing the cost of recycling plastic, including measures to encourage the standardisation of plastic packaging; to give powers to the Office for Environmental Protection to enforce legislation relating to plastic pollution; to make provision for the purpose of encouraging the development of sustainable alternatives to plastic packaging; to require the Government to publish a plan for the use of fiscal policy to incentivise investment in recycling infrastructure and sustainable behaviour by consumers and retailers in relation to plastic; to require the Government to publish a plan for agreeing a global treaty on plastic pollution reduction; and for connected purposes.","Plastics (Recycling, Sustainability and Pollution Reduction) Bill",Commons,1,37
3232,A Bill to prohibit the manufacture and sale of wet wipes containing plastic; and for connected purposes.,Plastics (Wet Wipes) Bill,Commons,1,37
3379,A Bill to require energy companies to allow a grace period before disconnecting customers with pre-payment meters who have run out of credit; to require energy companies to offer debt management support to all customers; and for connected purposes.,Pre-Payment Meters (Self-Disconnection) Bill,Commons,1,37
3390,A Bill to prohibit the installation of new pre-payment meters for domestic energy customers before 31 March 2023; and for connected purposes.,Pre-Payment Meters (Temporary Prohibition) Bill,Commons,1,37
3489,"A Bill to require the Secretary of State to appoint an independent reviewer to prepare a quarterly report containing an assessment of primary care services; to require the Secretary of State to lay before Parliament each report prepared by the independent reviewer; to require such reports to include the independent reviewer’s assessment of any measures taken to improve general practice services, dental services, community pharmacy services, optometry services, and mental health services; and for connected purposes.",Primary care services (report) Bill,Commons,1,37
3250,A Bill to impose duties on the Prime Minister relating to accountability to the House of Commons; to require the Prime Minister to be available to answer questions in that House on at least two occasions during a sitting week except in specified circumstances; and for connected purposes.,Prime Minister (Accountability to House of Commons) Bill,Commons,1,37
3251,"A Bill to make provision for the carrying out of the functions of the Prime Minister in the event that a Prime Minister, or a person temporarily carrying out the functions of the Prime Minister, is incapacitated; and for connected purposes.",Prime Minister (Temporary Replacement) Bill,Commons,1,37
3224,"A Bill to establish a public advocate to provide advice to, and act as data controller for, representatives of the deceased after major incidents.",Public Advocate (No. 2) Bill,Commons,1,37
3233,"A Bill to require the Government to have regard to the desirability of boards of public bodies including at least one person with relevant experience in at least one of Scotland, Wales and Northern Ireland.",Public Bodies (Representation from Devolved Nations) Bill,Commons,1,37
3273,A Bill to amend the Public Health (Control of Disease) Act 1984 to make provision about parliamentary scrutiny of regulations made under that Act; and for connected purposes.,Public Health (Control of Disease) Act 1984 (Amendment) Bill,Commons,1,37
3450,"A Bill to make provision for the purpose of preventing a person who has failed to discharge a duty in respect of child sexual abuse offences from holding any elected office, from holding public office and from holding any post the remuneration of which is paid out of money provided by Parliament; to provide for the disqualification from any elected or appointed office of a person who has been convicted of child sexual abuse offences; to provide for the removal of a peerage from a person who has been convicted of child sexual abuse offences; and for connected purposes.",Public office (child sexual abuse) Bill,Commons,1,37
3285,A Bill to limit exit payments made by some public sector organisations to employees; and for connected purposes.,Public Sector Exit Payments (Limitation) Bill,Commons,1,37
3299,A Bill to create the offence of impersonating a public sector website for the purpose of collecting payment or personal data; and for connected purposes.,Public Sector Website Impersonation Bill,Commons,1,37
3297,A Bill to prohibit the import of young puppies; and for connected purposes.,Puppy Import (Prohibition) Bill,Commons,1,37
3305,A Bill to require Her Majesty's Government formally to recognise the Armenian genocide of 1915–23; and for connected purposes.,Recognition of Armenian Genocide Bill,Commons,1,37
3361,A Bill to require a supermajority of votes in favour of a proposal for constitutional change on which a referendum is being held in order for it to be decided in the affirmative.,Referendums (Supermajority) Bill,Commons,1,37
3503,A Bill to require local authorities to publish a register of derelict buildings in their area; to make provision in respect of the preparation and maintenance of such registers; and for connected purposes.,Register of Derelict Buildings Bill,Commons,1,37
3279,A Bill to require a Regulatory Impact Assessment to be published for all primary and secondary legislation introduced by the Government; to make provision for associated sanctions; and for connected purposes.,Regulatory Impact Assessments Bill,Commons,1,37
3480,A Bill to make provision to require the sharing with parents and guardians of copies of materials used in relationships and sex education lessons in schools in England; to prohibit schools in England from using externally produced teaching resources for relationships and sex education that have not been published; and for connected purposes.,Relationships and Sex Education (Transparency) Bill,Commons,1,37
3401,A Bill to require the Secretary of State to report to Parliament on the merits of the House of Lords meeting in a large ballroom in Blackpool.,Relocation of the House of Lords (Report to Parliament) Bill,Commons,1,37
3289,A Bill to give the Monarch powers to remove titles; to provide that such removals can be done by the Monarch on their own initiative or following a recommendation of a joint committee of Parliament; and for connected purposes.,Removal of Titles Bill,Commons,1,37
3399,A Bill to reduce the duty charged on renewable liquid heating fuel; to provide for the imposition of obligations on suppliers of heating fuel in relation to the supply of renewable fuel; and for connected purposes.,Renewable Liquid Heating Fuel Bill,Commons,1,37
3462,"A Bill to make provision changing the law about rented homes, including provision abolishing fixed term assured tenancies and assured shorthold tenancies; imposing obligations on landlords and others in relation to rented homes and temporary and supported accommodation; and for connected purposes.",Renters (Reform) Bill,Commons,1,37
3485,A Bill to require His Majesty’s Government to recognise formally the Republic of Somaliland; to make provision in connection with the establishing of diplomatic relations with the Republic of Somaliland; and for connected purposes.,Republic of Somaliland (Recognition) Bill,Commons,1,37
3472,A Bill to require a person riding a bicycle on the public highway to wear a safety helmet; and for connected purposes.,Road Safety (Cycle Helmets) Bill,Commons,1,37
3386,A Bill to make provision about the regulation of roadworks; and for connected purposes.,Roadworks (Regulation) Bill,Commons,1,37
3281,A Bill to require public authorities to exercise their statutory powers to investigate and take enforcement action for breaches of the law; to make provision for sanctions for failing to take such action; and for connected purposes.,Rule of Law (Enforcement by Public Authorities) Bill,Commons,1,37
3487,A Bill to require the Secretary of State to establish a task force to produce a strategy for tackling rural crime; to require the Secretary of State to implement the strategy; and for connected purposes.,Rural Crime (Strategy) Bill,Commons,1,37
3486,"A Bill to require the Secretary of State to publish revised guidance on the deployment, visibility and signing of speed and red-light cameras for traffic enforcement; to require that guidance to include amended site selection criteria for safety cameras, including a lower threshold for the number of collisions in which a person is killed or seriously injured; to require that guidance to provide for a process by which local communities can express support for the installation of safety cameras in areas of concern; and for connected purposes.",Safety cameras Bill,Commons,1,37
3342,A Bill to prohibit the sale of property by sealed bids; and for connected purposes.,Sale of Property (Sealed Bids) Bill,Commons,1,37
3365,A Bill to make provision about the sale by retail of tobacco and related goods; and for connected purposes.,Sale of Tobacco (Licensing) Bill,Commons,1,37
3438,A Bill to enable clergy of the Church of England to conduct same sex marriages on Church of England premises in certain circumstances; and for connected purposes.,Same Sex Marriage (Church of England) Bill,Commons,1,37
3413,A Bill to amend the Scotland Act 1998 to transfer the power to legislate for a Scottish independence referendum to the Scottish Parliament; to provide that that power may only be exercised where the Scottish public has demonstrated its support for the holding of such a referendum; to provide that no such referendum may be held sooner than seven years after the previous such referendum; and for connected purposes.,Scotland (Self-Determination) Bill,Commons,1,37
3411,A Bill to make the offence of driving or riding in a motor vehicle on a road without a seat belt an endorsable offence; and for connected purposes.,Seat Belts (Penalty Points) Bill,Commons,1,37
3415,A Bill to require the Secretary of State to lay before Parliament proposals for the seizure of Russian state assets to provide support for Ukraine; and for connected purposes.,Seizure of Russian State Assets and Support for Ukraine Bill,Commons,1,37
3428,A Bill to prohibit a person subject to notification requirements under Part 2 of the Sexual Offences Act 2003 from changing their name; and for connected purposes.,Sexual Offences (Prohibition of Name Change) Bill,Commons,1,37
3238,A Bill to amend the Sentencing Code to provide for a minimum sentence for cases of manslaughter which are sexually-motivated.,Sexually-motivated Manslaughter (Sentencing) Bill,Commons,1,37
3395,A Bill to make provision about shared parental leave and pay in certain cases where one or both of a child’s parents has died; and for connected purposes.,Shared Parental Leave and Pay (Bereavement) Bill,Commons,1,37
3220,"A Bill to give local authorities the power to require licences for the conversion of domestic properties into short-term and holiday-let accommodation; to give local authorities the power to issue fines and to remove such licences when safety, noise and nuisance conditions have not been met; to make provision about banning the licensing of such properties in defined geographical areas; to give local authorities the power to vary the rates of local taxes in relation to such properties; to give local authorities the power to restrict the number of days per year for which such properties can be let; and for connected purposes.",Short-term and Holiday-let Accommodation (Licensing) Bill,Commons,1,37
3265,A Bill to require the Secretary of State to publish annual calculations of benefit and tax credit rates that would be required for a representative household to afford to buy meals in accordance with the Eatwell Guide to eating healthily; and for connected purposes.,Social Security Benefits (Healthy Eating) Bill,Commons,1,37
3473,"A Bill to make provision about the law in relation to administering or attempting to administer drugs, alcohol or any other substance to a person without their consent, whether or not with the intent to cause harm; and for connected purposes.",Spiking Bill,Commons,1,37
3418,A Bill to exempt sun protection products from VAT; and for connected purposes.,Sun Protection Products (Value Added Tax) Bill,Commons,1,37
3327,A Bill to make the offence of supplying or offering to supply a controlled drug aggravated when the person to whom the drug is supplied or offered is under 16; and for connected purposes.,Supply of Drugs to Children Under 16 (Aggravated Offence) Bill,Commons,1,37
3369,A Bill to establish a commission to assess the differential impact of the tax system in the UK on different groups of people; to require that commission to make recommendations for reform of the tax system; and for connected purposes.,Tax Reform Commission Bill,Commons,1,37
3374,A Bill to place a duty on the Secretary of State to promote the safety and wellbeing of teenagers; to make provision to prevent crime against teenagers; and for connected purposes.,Teenagers (Safety and Wellbeing) Bill,Commons,1,37
3225,A Bill to make provision about mandatory local consultation in relation to the installation of telecommunications infrastructure in residential areas; and for connected purposes.,Telecommunications Infrastructure (Consultation) Bill,Commons,1,37
3201,A Bill to require utility companies to provide financial support to customers with a terminal illness; to make provision about the employment rights of people with a terminal illness; and for connected purposes.,Terminal Illness (Support and Rights) Bill,Commons,1,37
3483,"A Bill to establish a new model of company structure for Thames Water, to be called a public benefit corporation; to require that public benefit corporation to consider public policy benefits, including reducing leaks and sewage dumping, as well as returns for shareholders; to limit the payment of dividends until a plan is in place to cut the corporation’s debt; and to require membership of the corporation’s board to include representatives of local environment groups.",Thames Water (Public Benefit Corporation) Bill,Commons,1,37
3373,A Bill to provide for the implementation of the United Kingdom’s free trade agreements with Australia and New Zealand to be subject to approval by resolution by each House of Parliament; and for connected purposes.,Trade (Australia and New Zealand) (Parliamentary Approval) Bill,Commons,1,37
3350,To make provision about minimum service levels in connection with the taking by trade unions of strike action relating to transport services.,Transport Strikes (Minimum Service Levels) Bill,Commons,1,37
3419,A Bill to set limits on the use of toxic chemicals in the manufacture of tyres; and for connected purposes.,Tyre Manufacture (Toxic Chemicals) Bill,Commons,1,37
3262,A Bill to require the Secretary of State to report to Parliament on the merits of repealing those provisions of the Welfare Reform Act 2012 which provide for persons to be paid reduced rates of housing benefit or universal credit because their accommodation is deemed to be under-occupied.,Under-Occupancy Penalty (Report) Bill,Commons,1,37
3260,A Bill to amend the Welfare Reform Act 2012 to provide that a Universal Credit claimant may not be sanctioned for refusing work on a zero hours contract; and for connected purposes.,Universal Credit Sanctions (Zero Hours Contracts) Bill,Commons,1,37
3454,"A Bill to provide that offences of genocide, crimes against humanity and war crimes may be tried in the United Kingdom regardless of the nationality or residence of the offender; and for connected purposes.",Universal Jurisdiction (Extension) Bill,Commons,1,37
3252,A Bill to prohibit persons from being registered to vote in Parliamentary elections at more than one address; and for connected purposes.,Voter Registration Bill,Commons,1,37
3228,A Bill to establish an independent public inquiry into the administration of the War Pension Scheme and of the Armed Forces Compensation Scheme by Veterans UK; and for connected purposes.,War Pension Scheme and Armed Forces Compensation Scheme (Public Inquiry) Bill,Commons,1,37
3439,"A Bill to make provision about the monitoring of water quality; to set a target for the reduction of sewage discharges; to provide for financial penalties in relation to sewage discharges and breaches of monitoring requirements; to require the Secretary of State to publish a strategy for the reduction of sewage discharges from storm overflows, including an economic impact assessment; and for connected purposes.",Water Quality (Sewage Discharge) Bill,Commons,1,37
3253,A Bill to make provision about workers’ rights; to amend the definition of worker; and for connected purposes.,Workers (Rights and Definition) Bill,Commons,1,37
3349,A Bill to amend the Working Time Regulations 1998 to reduce the maximum working week from 48 hours per week to 32 hours per week and to provide for overtime pay; and for connected purposes.,Working Time Regulations (Amendment) Bill,Commons,1,37
3427,A Bill to amend the Crown Estate Act 1961 to increase the maximum term of the lease that may be granted to the Zoological Society of London in respect of land in Regent’s Park; and for connected purposes.,Zoological Society of London (Leases) Bill,Commons,1,37
3049,A Bill to make provision for and in connection with offences relating to verbal and physical abuse of public-facing workers in the course of their employment.,Abuse of Public-facing Workers (Offences) Bill,Commons,1,36
2910,A Bill to make provision about meeting the needs of adults and children with an acquired brain injury; and for connected purposes.,Acquired Brain Injury Bill,Commons,1,36
3105,A Bill to make provision for local authorities to conduct annual audits of air pollution in their area and associated emissions by public and private entities; to require those local authorities to prepare reports on those audits; to require the Secretary of State to report annually to Parliament on those audit reports; and for connected purposes.,Air Pollution (Local Authority Audits) Bill,Commons,1,36
3081,A Bill to require ambulance services to provide more accessible and localised reports of ambulance response times; and for connected purposes.,Ambulance Waiting Times (Local Reporting) Bill,Commons,1,36
2880,"A Bill to make provision about the welfare of certain kept animals that are in, imported into, or exported from Great Britain.",Animal Welfare (Kept Animals) Bill,Commons,1,36
2972,A Bill to require Her Majesty's Government to formally recognise the Armenian genocide of 1915-16.,Armenian Genocide (Recognition) Bill,Commons,1,36
2995,A Bill to make provision for asylum seekers to challenge the proportionality of a proposed eviction from accommodation before an independent court or tribunal; to establish asylum seeker accommodation eviction procedures for public authorities; and for connected purposes.,Asylum Seekers (Accommodation Eviction Procedures) Bill,Commons,1,36
2918,A Bill to make provision for granting permission to work to asylum seekers who have waited six months for a decision on their asylum application; and for connected purposes.,Asylum Seekers (Permission to Work) Bill,Commons,1,36
3003,A Bill to make provision for granting permission to work to asylum seekers who have waited six months for a decision on their asylum application; and for connected purposes.,Asylum Seekers (Permission to Work) (No. 2) Bill,Commons,1,36
2961,A Bill to require asylum seekers who have arrived in the United Kingdom from a safe country to be immediately returned to that country; and for connected purposes.,Asylum Seekers (Return to Safe Countries) Bill,Commons,1,36
3011,"A Bill to require the installation of automated external defibrillators in public buildings, sporting facilities, schools, higher education and other education and skills facilities, and facilities that provide care to vulnerable people; and to make associated provision about training and signage.",Automated External Defibrillators (Public Access) Bill,Commons,1,36
2982,"A Bill to require the Chancellor of the Exchequer to report to Parliament on proposals to replace the Barnett Formula used to calculate adjustments to public expenditure allocated to Scotland, Wales and Northern Ireland with a statutory scheme for the allocation of resources based on an assessment of relative needs; and for connected purposes.",Barnett Formula (Replacement) Bill,Commons,1,36
2962,A Bill to abolish the BBC licence fee and make the BBC a subscription service; and for connected purposes.,BBC Licence Fee (Abolition) Bill,Commons,1,36
2980,A Bill to de-criminalise the non-payment of the BBC licence fee by persons aged over seventy five; and for connected purposes.,BBC Licence Fee Non-Payment (Decriminalisation for Over-75s) Bill,Commons,1,36
3122,"A Bill to require the Secretary of State to report to Parliament on the likely effects of the abolition of the benefit cap, including on levels of absolute and relative poverty, poor mental health, food bank use, borrowing of money from friends and family, evictions from homes and problem debt, and on different groups including women, lone parents and people from Black and minority ethnic backgrounds; and for connected purposes.",Benefit Cap (Report on Abolition) Bill,Commons,1,36
2997,A Bill to make provision for warnings to be given to benefit claimants before they are given sanctions; and for connected purposes.,Benefit Sanctions (Warnings) Bill,Commons,1,36
3016,A Bill to make provision about leave and pay for employees of whom a close family member has died.,Bereavement (Leave and Pay) Bill,Commons,1,36
3054,A Bill to extend entitlement to parental bereavement leave and pay to parents of babies miscarried or stillborn during early pregnancy; and for connected purposes.,Bereavement Leave and Pay (Stillborn and Miscarried Babies) Bill,Commons,1,36
3146,"A Bill to make provision for the purposes of increasing uptake of NHS Breast Screening Programme appointments, including in groups currently less likely to take up such appointments; to extend eligibility to that programme to persons at an increased risk of breast cancer because of their family history; and for connected purposes.",Breast Screening Bill,Commons,1,36
2978,A Bill to make provision for the privatisation of the British Broadcasting Corporation; and for connected purposes.,British Broadcasting Corporation (Privatisation) Bill,Commons,1,36
